,시군구,lat,lng,제목,모집기관,formatted_address,봉사기간
0,대구광역시 수성구,35.8610493,128.6458843, 수성장애인주간보호센터 자원봉사자 모집 ,수성장애인주간보호센터,대한민국 대구광역시 수성구 만촌2동 999-15,2019-01-01 2019-12-31
1,대구광역시 수성구,35.8290078,128.7105335, 프로그램 활동보조 자원봉사자 모집,대구광역시시지노인전문병원,대한민국 대구광역시 수성구 고산1동 유니버시아드로 365,2019-08-22 2019-12-31
2,대구광역시 수성구,35.8265788,128.6070623, 아동프로그램 정기자원봉사자 모집안내,대구장애인종합복지관,대한민국 대구광역시 수성구 파동,2019-09-03 2019-12-12
3,대구광역시 수성구,35.8242756,128.6428865, [수성구청 행복공동체조성사업] 영화  시사회 보조,지산종합사회복지관,대한민국 대구광역시 수성구 지산동 1297,2019-08-30 2019-08-30
4,대구광역시 수성구,35.8290078,128.7105335, 프로그램보조 자원봉사자 모집,대구광역시시지노인전문병원,대한민국 대구광역시 수성구 고산1동 유니버시아드로 365,2019-08-23 2019-08-30
5,대구광역시 수성구,35.8398622,128.7103917, 대구시지노인병원 재가노인지원센터 토요일 차량 이동 보조 봉사자 모집합니다,대구시지노인병원 재가노인지원센터,대한민국 대구광역시 수성구 고산3동 달구벌대로647길 7 A동 203호,2019-08-31 2020-08-19
6,대구광역시 수성구,35.8398622,128.7103917, 대구시지노인병원재가노인지원센터 토요일 청소 봉사 모집,대구시지노인병원 재가노인지원센터,대한민국 대구광역시 수성구 고산3동 달구벌대로647길 7 A동 203호,2019-08-31 2020-08-01
7,대구광역시 수성구,35.8398622,128.7103917, 주간보호센터 이미용 봉사자 구합니다,대구시지노인병원 재가노인지원센터,대한민국 대구광역시 수성구 고산3동 달구벌대로647길 7 A동 203호,2019-08-05 2020-08-04
8,대구광역시 수성구,35.8242756,128.6428865, 급식소 조리봉사활동,지산종합사회복지관,대한민국 대구광역시 수성구 지산동 1297,2019-09-02 2019-12-31
9,대구광역시 수성구,35.8193176,128.6488517, 범물노인복지관 범물마실 찬찬찬 사업 보조,범물노인복지관,대한민국 대구광역시 수성구 범물1동 1288,2019-08-06 2019-12-17
10,대구광역시 수성구,35.8578354,128.6523552, 청도 나들이 자원봉사자를 모집합니다 ,룸비니동산,대한민국 대구광역시 수성구 만촌2동 달구벌대로527길 13-12,2019-08-25 2019-08-25
11,대구광역시 수성구,35.8664245,128.6254816, 학습봉사구합니다,사회복지법인 서정길대주교재단 수지의집,대한민국 대구광역시 수성구 범어3동 5-1,2019-07-04 2019-12-31
12,대구광역시 수성구,35.8411411,128.6299045, 치매어르신 미술치료 봉사,대구노인복지센터,대한민국 대구광역시 수성구 황금동 478-4,2019-07-01 2019-12-31
13,대구광역시 수성구,,,  생명사랑밤길걷기캠페인 자원봉사자 모집  마감완료,산격종합사회복지관,,2019-08-31 2019-09-01
14,대구광역시 수성구,35.8376078,128.6985754, 아시아재활교육센터(청곡장애인주간보호센터) 프로그램 활동보조 자원봉사자 모집,아시아재활교육센터,대한민국 대구광역시 수성구 노변동 161-4,2019-07-01 2019-12-31
0,대구광역시 수성구,35.8242756,128.6428865, 어르신 안부확인 봉사자모집,지산종합사회복지관,대한민국 대구광역시 수성구 지산동 1297,2019-08-22 2019-12-31
1,대구광역시 수성구,35.8411411,128.6299045, 대구시노인복지관 경로급식 설거지 봉사자 모집,대구광역시노인종합복지관,대한민국 대구광역시 수성구 황금동 478-4,2019-06-07 2019-12-31
2,대구광역시 수성구,35.8411411,128.6299045, 국민건강 총명학교 서포터즈 모집 ,대구광역시노인종합복지관,대한민국 대구광역시 수성구 황금동 478-4,2019-08-22 2019-11-21
3,대구광역시 수성구,35.8575985,128.6296926, [홀트복지관] 중학생 학습지도 자원봉사자 모집 ,홀트대구종합사회복지관,대한민국 대구광역시 수성구 범어동 238-50,2019-05-29 2019-12-31
4,대구광역시 수성구,35.8195316,128.6148172, 학습 지도,강촌공부방지역아동센터,대한민국 대구광역시 수성구 파동 110-54,2019-05-27 2019-12-31
5,대구광역시 수성구,35.8376078,128.6985754, 청곡 초등 방과후 교실 학습지도 봉사,청곡종합사회복지관,대한민국 대구광역시 수성구 노변동 161-4,2019-05-21 2019-12-31
6,대구광역시 수성구,,, 청정원주부봉사단 대구팀 모집,대상(주),,2019-05-07 2019-12-31
7,대구광역시 수성구,35.872276,128.6432048, [긴급]이미용 자원봉사자 모집,마야노인복지센터,대한민국 대구광역시 수성구 만촌동 공경로 55-3 2층,2019-04-26 2019-12-31
8,대구광역시 수성구,35.8203723,128.6419447, 발달장애인 교육 활동 보조 및 환경미화 ,발달장애인자립지원협회,대한민국 대구광역시 수성구 범물동 지범로39길 11 2층,2019-08-10 2019-12-28
9,대구광역시 수성구,35.8578354,128.6523552, 정기 주방보조 자원봉사단을 모집합니다 ,룸비니동산,대한민국 대구광역시 수성구 만촌2동 달구벌대로527길 13-12,2019-04-04 2019-12-31
10,대구광역시 수성구,35.8575985,128.6296926, [홀트복지관] 무료급식 조리세척 봉사자모집,홀트대구종합사회복지관,대한민국 대구광역시 수성구 범어동 238-50,2019-04-04 2019-12-31
11,대구광역시 수성구,35.8242756,128.6428865, 치매예방프로그램  미술공예 보조 자원봉사자 ,지산종합사회복지관,대한민국 대구광역시 수성구 지산동 1297,2019-04-02 2019-11-30
12,대구광역시 수성구,35.8242756,128.6428865, 어르신 걷기 운동 보조,지산종합사회복지관,대한민국 대구광역시 수성구 지산동 1297,2019-04-02 2019-11-30
13,대구광역시 수성구,35.8193299,128.6460651, [월드비전 범물종합사회복지관] 목욕봉사자 모집,범물종합사회복지관,대한민국 대구광역시 수성구 범물동 범안로 79,2019-08-16 2020-12-31
14,대구광역시 수성구,35.8575985,128.6296926, 홀트 장애청소년 성장교실 나래핀 수업 진행 보조 봉사자 모집,홀트대구종합사회복지관,대한민국 대구광역시 수성구 범어동 238-50,2019-03-12 2019-12-10
0,대구광역시 수성구,35.8575985,128.6296926, 홀트 장애 청소년 성장교실 나래핀 수업 보조 봉사자 모집,홀트대구종합사회복지관,대한민국 대구광역시 수성구 범어동 238-50,2019-03-04 2019-12-31
1,대구광역시 수성구,35.872276,128.6432048, [긴급]이미용 자원봉사자 모집,마야노인복지센터,대한민국 대구광역시 수성구 만촌동 공경로 55-3 2층,2019-03-04 2019-12-31
2,대구광역시 수성구,35.8595129,128.6434615, 이용장애인 케어,한울장애인주간보호센터,대한민국 대구광역시 수성구 만촌2동 만촌로1길 37,2019-02-25 2019-12-31
3,대구광역시 수성구,35.8308646,128.7046878, 어르신 정서지원 봉사,(사)달구벌복지회 달구벌노인복지센터,대한민국 대구광역시 수성구 고산1동 고산로4안길 59 203호,2019-02-19 2019-12-31
4,대구광역시 수성구,35.8308646,128.7046878, 재가노인지원사업 밑반찬 지원업무 및 보조,(사)달구벌복지회 달구벌노인복지센터,대한민국 대구광역시 수성구 고산1동 고산로4안길 59 203호,2019-02-18 2019-12-31
5,대구광역시 수성구,35.8411411,128.6299045, 상담봉사플래너봉사단 모집,대구광역시노인종합복지관,대한민국 대구광역시 수성구 황금동 478-4,2019-04-01 2019-11-30
6,대구광역시 수성구,35.8376078,128.6985754, 밑반찬 배달 자원봉사,청곡종합사회복지관,대한민국 대구광역시 수성구 노변동 161-4,2019-02-08 2099-02-08
7,대구광역시 수성구,35.8575985,128.6296926, 홀트 가족자원봉사단 기 모집,홀트대구종합사회복지관,대한민국 대구광역시 수성구 범어동 238-50,2019-03-09 2019-12-14
8,대구광역시 수성구,35.851049,128.6130521, 수성베네스트에서 자원봉사자 모집합니다,사회복지법인 수성베네스트,대한민국 대구광역시 수성구 수성동1가 423-3,2019-01-31 2019-12-31
9,대구광역시 수성구,35.8575985,128.6296926, [홀트복지관] 무료급식소 배달자원봉사자 모집,홀트대구종합사회복지관,대한민국 대구광역시 수성구 범어동 238-50,2019-01-23 2019-12-31
10,대구광역시 수성구,35.872276,128.6432048, [긴급]이미용 자원봉사자 모집,마야노인복지센터,대한민국 대구광역시 수성구 만촌동 공경로 55-3 2층,2019-01-17 2019-12-31
11,대구광역시 수성구,35.8578354,128.6523552, 댄스프로그램 봉사자모집,룸비니동산,대한민국 대구광역시 수성구 만촌2동 달구벌대로527길 13-12,2019-01-11 2019-11-30
12,대구광역시 수성구,35.8423746,128.7243619, 이미용 봉사,성림노인요양원,대한민국 대구광역시 수성구 사월동 9,2019-01-13 2019-12-08
13,대구광역시 수성구,35.8242756,128.6428865, 도시락 배달봉사차량배달 봉사자모집,지산종합사회복지관,대한민국 대구광역시 수성구 지산동 1297,2018-11-19 2019-11-01
14,대구광역시 수성구,35.8543348,128.6122449, 이미용 봉사,청인재가노인복지센터,대한민국 대구광역시 수성구 수성1가동 명덕로 384 3층,2019-04-23 2019-12-31
0,대구광역시 수성구,35.8376078,128.6985754, 경로식당 단체자원봉사 팀 모집,청곡종합사회복지관,대한민국 대구광역시 수성구 노변동 161-4,2018-10-10 2058-10-10
1,대구광역시 수성구,35.872276,128.6432048, 이미용 자원봉사자 모집,마야노인복지센터,대한민국 대구광역시 수성구 만촌동 공경로 55-3 2층,2018-09-01 2019-12-31
2,대구광역시 수성구,35.8575985,128.6296926, 급식소 세척봉사자 모집합니다,홀트대구종합사회복지관,대한민국 대구광역시 수성구 범어동 238-50,2018-03-02 2019-12-31
3,대구광역시 수성구,35.8190358,128.6132431, 장애청소년 대상 프로그램 보조 자원봉사 선생님 모십니다,수성구장애청소년자립지원센터,대한민국 대구광역시 수성구 파동 27-302 1층,2019-01-01 2020-01-31
4,대구광역시 수성구,35.8663984,128.6297888, [늘사랑청소년센터] 학습활동 재능기부 봉사자 모집합니다 ,늘사랑청소년센터,대한민국 대구광역시 수성구 범어2동 국채보상로 906,2019-05-01 2020-05-01
5,대구광역시 수성구,35.8575985,128.6296926, 도시락 배달 봉사자 모집합니다,홀트대구종합사회복지관,대한민국 대구광역시 수성구 범어동 238-50,2016-10-12 2019-10-11
